person_id,why_are_pid_with_when,prob_machine_generated,n_tokens,glimpse_criterion
US:125092189,There doesnt need to be any political parties or sides. Should just be decided by the people.,0.26,19,-3.584913128004754
US:29987594,"Because the democrats are for the people, and the republicans are for themselves.",0.71,17,-0.2631885532790455
US:43433344,They value freedom and better budgeting compared to democrats.,0.23,12,-5.860164232904615
US:132615231,"Democrats (used to) care about basic human rights, equality, and a better future...",0.31,18,-2.852913487550984
US:122540365,"Both Democrats and Republicans promote more government control, bigger more expensive government, deficit spending and less freedom.",0.26,20,-3.59242307643967
US:198557527,I value people over property,0.36,5,-2.3683421916580505
US:127240955,Felt the values were aligned.,0.34,7,-2.5185942763831117
US:759551,Democrats are more helpful with legislation people need. They do not take away our FREEDOMS such as FREE SPEECH.,0.23,25,-4.176721925247636
US:140197463,Represent what I believe government is supposed to do.,0.23,10,-5.840799072253516
US:173948357,They align with my ideals more than Democrats on a majority of topics,0.26,13,-3.4840142847062383
US:166723,I like to be on the right side,0.81,8,0.3372131242927268
US:35741699,Their views are rooted in reality.,0.41,7,-1.929467539468317
US:57191,Neither party is honest or fair.,0.33,7,-2.6025643300115218
US:24941192,"Bill Clinton, Gore, Kerry, and the others seem fake and radical. They don't align with my thoughts or lifestyle or values.",0.23,27,-4.23347608588597
US:164729033,I don’t agree on any social issues with the republicans,0.38,12,-2.2052712634071034
US:23388555,"Although the Republicans are too far left for my preference, the Democrats are even farther left",0.54,17,-1.1465952867497247
US:41986460,felt Obama seemed to be dividing of people. the reaction to people who were upset about taxes and losing their jobs. felt that Obama didn't want to hear what other people had to say. he was very haughty.,0.25,44,-3.730989567425284
US:164481283,"This is described above but I will elaborate, there are issues that I align more with SOME Republicans while there are absolutely no candidates on the other side that I agree with on most things. Democrats are truly insane and believe the dumbest things.",0.22,48,-5.4692392581183364
US:169500497,I lost respect and confidence in the Democratic Party.,0.43,10,-1.8298951672562471
US:28574391,Did not like the leadership from the democrats,0.27,9,-3.419658144179535
US:196117905,Conservative values and economic interests,0.36,6,-2.359181892527535
US:125585737,Social issues,0.31,2,-2.854766413349401
US:1658830,"Because Donald Trump, and his supporters, are racists.",0.5,12,-1.3440296187742016
US:1734737,The Republican party's views closely resemble my own .,0.24,10,-3.872322140368909
US:196843025,I liked the way they handled 9-11.,0.53,11,-1.2098249508805006
US:137324923,"I believe in the principles of the TRADITIONAL, ""New Deal"" Democratic Party.",0.78,18,0.130512603453922
US:2176265,Because I'm a rational ethical person.,0.23,8,-4.371273435883425
US:179611313,"I believe in smaller government, protection of the unborn, that everyone has the ability to rise above their circumstances and responsible spending",0.39,24,-2.1287832843560968
US:149179539,They are more aligned with my values,0.45,7,-1.6492203394744842
US:141168613,"Human rights, civil rights",0.3,5,-2.9519317546355337
US:152310277,I think Republicans are only for the wealthy!,0.37,9,-2.2681569898185217
US:168035339,Democrats are liars and traitors,0.23,7,-4.193609412803826
US:30842707,parents were democrats,0.48,4,-8.650275656489114
US:152960151,To keep the Republicans in charge.,0.23,7,-4.263611541567228
US:155631389,It didn’t make sense what the professor was preaching,0.28,10,-3.240999598883691
US:40372424,Democrats represent working people and gave a strong empathy for the downtrodden.,0.23,15,-5.716651660214658
US:820018,Dems are for all people while republicans are for rich people.,0.67,14,-0.47177231461375224
US:41294859,I’m a republican because I work hard to put food on the table. I find democrats ruthless and lying people. Democrats only care about themselves,0.34,29,-2.549943886362932
US:195096733,I hate Republicans,0.27,3,-3.381839973297884
US:1411228,"Because the Democrats became so increasingly vile, treasonous, and corrupt than I could no longer vote for them any longer.",0.24,24,-3.935380719377174
US:203269815,The democrats have been far left and anti American since Obama,0.5,12,-1.3444451152525556
US:139152123,"they're both beholden to their corporate overlords and don't care about people, only power",0.39,19,-2.0826307805464634
US:537359,I will never vote for a Democrat again,0.75,8,8.676803424767279e-05
US:26006856,When Republicans became too extreme on various issues and over the wars in Afghanistan and Iraq.,0.22,17,-5.244719495627242
US:1676013,My values seemed to be the most in tune with them.,0.43,12,-1.780045970837886
US:191074,"A belief in individuals being seen and judged as individuals, equality of opportunity, anti-class warfare, long term growth focused, proper trade and peace policy.",0.22,30,-5.479255519723551
US:3157912,Because I was a Democrat until Dennis DeConcini Voted to give up the Panama Canal. My husband and I immediately changed our status from Democrat to Republican and have never looked back. We are so glad we did.,0.42,45,-1.9074248566220462
US:154730117,Both groups prefer performative behavior and getting reelected over solving issues. Both groups do everything they possibly can to separate the public so they can continue their power grabs,0.24,33,-3.8541656854783075
US:30715398,They are more compassionate and their policies make more sense in terms of helping the people,0.44,16,-1.7281178508338588
US:188236759,I align more closely to their beliefs.,0.25,8,-3.725251153988619
US:1241389,believe in conservative view - less government the better,0.22,10,-4.9777047809621076
US:41148566,They are the party that cares for ALL Americans.,0.42,10,-1.8470893948385505
US:120805729,not interested in politics,0.33,4,-2.650302011739083
US:1756893,"I agree with the party platform even though both parties participate in the same swamp. democrats founded KKK, voted against blacks in many areas, and have become so extreme! Open borders, illegal aliens voting, individual judges have more power than the president, consider our ‘democracy’ at risk (though we are a representative republic) want to get rid of electoral college system so NY Chicago and LA rule the rest of us, etc",0.22,87,-5.265511933320311
US:1929704,They are more inline with my views. And for the most part respect our constitution and laws (the only exception their violations of international law in support the illegals occupation of Palestine ).,0.22,36,-5.195813978504825
US:153846539,I decided I'm closer to the democratic party because they focus on the wellbeing of people more than other parties,0.32,21,-2.6832628385655752
US:43999730,"They care about U.S. citizens, the economy, the country as a whole",0.51,16,-1.3351941279388322
US:182526739,Women's rights,0.53,3,-1.1986595537036493
US:167901299,In line with my views,0.43,5,-1.7874385990913784
US:27101300,Liberal left not my thing,0.25,6,-3.7564370331842687
US:186313543,They are more aligned with my principles,0.36,7,-2.305851245529314
US:184870285,I signed up as independent but wanted to be able to participate in all the elections. I grew with democratic parents and I agree and align with their views so I never even second guessed it.,0.22,38,-4.772791808678387
US:30178469,FAMILY IS DEMOCRATIC,0.24,6,-3.841921063695494
US:141575825,I align with their views and feel they help the country.,0.37,12,-2.2566340330518733
US:25453579,because my parents were so i followed there steps.,0.22,10,-4.569437620530631
US:131271597,There are stances of both parties that I agree with and disagree with,0.68,14,-0.40352751911282586
US:158967485,I don't agree with Republicans policies,0.23,7,-4.12242904639904
US:509302,"Being gay, wanting to marry, pro women’s rights, and believe that government job is provide a hand up, and have resources ready for when people need to en, even if I never need to use them.",0.23,43,-5.740433114883055
US:4522925,I believe that every person had value and worth and deserves to be treated fairly and not have their rights denied them.,0.55,23,-1.0714526470160881
US:172770403,My parents are republican and showed me how they are typically the lesser evil. I know now you really can't trust anyone,0.3,24,-2.974903731157055
US:174104975,"There are at least a few republicans I like, but no democrats",0.28,15,-3.189457253533584
US:42583995,I tend to agree more with social issues of the Democratic Party,0.27,12,-3.2981598034377084
US:2488092,"I feel they care more about Middle America, Christian values, and common sense.",0.28,16,-3.252225241553772
US:4365090,Because I want to be more liberal,0.32,7,-2.7441051837916772
US:41018505,The party believes in economic freedom and the liberty and freedom of each individual. There view of limited government.,0.26,21,-3.5544284871279013
US:203144991,Realizing that the GOP wants to cut programs that would meaningfully harm folks,0.26,15,-3.4576998871644693
US:174873585,Policies & honesty,0.22,4,-5.551462789567517
US:39596627,More concerned with the 'normal' people rather than the corupt,0.34,13,-2.560625066164171
US:2308346,I believe in equality of all humans and to take care of all humans equally and with dignity.,0.68,19,-0.4183908846516252
US:200629091,because both parties are corrupt,0.22,5,-4.734157998576003
US:202775027,Trump is getting Alzheimer’s disease and can’t remember what he says from one day to the next. I don’t appreciate his style of dictatorship. He’s corrupt and cold hearted.,0.32,37,-2.6884167259315315
US:170673155,"I follow Catholic social teaching, and both parties violate this.",0.22,12,-4.505108453364415
US:569257,"They had nothing but an affair, which is not an impeachable offense. They were technically right because he lied, but morally wrong. It was pay back for impeaching Nixon.",0.25,36,-3.8012179466225264
US:1906062,i felt there was a choice,0.26,6,-3.505989370140119
US:39510773,I don’t believe in abortions or the gender mess going on with kids.,0.24,15,-4.059777100191134
US:181817481,"Because I'm not a victim, and I hate bullies.",0.39,13,-2.10567593134382
US:33399698,Same as above,0.53,3,-1.212979048980094
US:2291102,The party espoused values such as social fairness and justice which I supported.,0.27,15,-3.359101690960956
US:46110889,Because I can think for myself unlike mindless woke democrats,0.3,12,-7.19328851897429
US:191849051,I lean more towards their values,0.27,6,-3.3909877701748794
US:4599182,Family always voted for democrats.,0.23,7,-4.252114355009346
US:26900045,I cannot actively vote for a Republican that worships Trump.,0.22,12,-4.643950330150091
US:141933759,More followed my beliefs,0.33,4,-7.553379540938853
US:29445403,It aligned with my values,0.3,5,-2.9784021951711104
US:741692,"They are they same, just switch sides every few years to stay in power and keep useful idiots confused",0.26,20,-3.5934789005612773
US:35099635,their values are closer to mine than republicans,0.24,9,-3.8548564153523963
US:177669219,Repubs have a sound platform but don't follow it so I can't be a Repub. Instead I'm a Libertarian,0.54,26,-1.1570751512013957
US:178894325,"I am for the people and not the elected officials. In no way do I agree with our current administration, they are not for everyday people.",0.72,29,-0.16161854966132533
US:36320918,The Republican party proved to me that they are NOT the party of law and order; NOT the party of personal responsibility; NOT the party of small government. They want a theological authoritarian government.,0.43,38,-1.8207135402613084
US:44547027,"Because Democrats lie, cheat and steal. They only care about themselves and not the people that they represent",0.45,20,-1.6590436460270364
US:25216084,They follow my views,0.23,4,-4.426412782608117
US:1964367,After Rick Scott became governor of Florida.,0.22,8,-4.975517056347352
US:171992063,Social issues... general just more respect for differing groups,0.56,10,-9.109131839758547
US:3053018,When Fox News started to become a propaganda tool for the far right. The conspiracy theories were too much.,0.49,21,-1.4217350639477284
US:174811825,I think that neither party can be trusted,0.56,8,-1.0474589834317785
US:27659037,I believe in regulation of banking and industry. I think Democrats more closely reflect my values,0.25,17,-3.6224597296483667
US:188851381,Because the left wants socialism,0.22,5,-4.614097394564278
US:34434658,Neither of the two major corrupt right of center parties align with my values.,0.26,15,-3.598589037203222
US:131216537,republicans went right wing,0.24,6,-4.0673597379761555
US:129511861,"It was the way I was raised. Democrats were for the little guy but no more. Now they are the party of far left radical freaks who have no common sense and no religion and no morality. The party of John and Bobby Kennedy is dead. They won't help the common man unless you are illegal, transsexual or non white.",0.46,69,-1.6375214038054409
US:4215486,republicans are only in it for the rich,0.58,10,-0.9416388700398648
US:187207903,Neither have candidates that represent me.,0.22,7,-4.779359257268471
US:1613146,Because both parties stifle dissent.,0.22,7,-5.433613713593214
US:177518027,"Bc I believe in freedom of choice, women's rights, black lives matter, trans rights are human rights, burn the oligarchs",0.28,27,-3.236434206289751
US:1766805,The Democratic party is made up of sane people who aren't out to sabotage the citizens and take revenge on the people who disagree with them. Democrats are civil.,0.29,32,-3.0542110690157407
US:187587997,Because of the pro life and family. Improving economy improve support for our allies. Support for women in sports removing DEi to allow for no bias,0.38,30,-8.023391362734694
US:140252657,I still consider my values closer to the Democratic Party but the party is now controlled by crazies on the far left. But Covid and censorship during covid made me leave for good.,0.22,36,-4.858469381675483
US:27005671,Democrats are corrupt.,0.3,4,-2.986245306166667
US:175232405,I don’t like politics,0.53,5,-1.1795583223942627
US:42716313,I believe it’s for the working class,0.31,8,-2.777513953986494
US:28884717,Porque los demócratas están con los inmigrantes,0.38,14,-2.1605515302684464
US:185716513,Their purported values aligned most closely with mine,0.22,8,-4.666383853687007
US:191187007,"Democrats in Maryland are lunatics who will gladly make life more expensive on you for their own financial benefit. For instance, the county was trying to regulate food choices at county run events like the 4th of July. It was at that moment where I knew that Democrats were playing too much. However, subsequent tax decisions further cemented my status as a republican even if I disagree with many prominent national republicans.",0.23,83,-5.900592809825952
US:100792235,Their values and views are much more in line with my own.,0.73,13,-0.12169600567210224
US:22539615,I don't want conservative ideas to dictate this government.,0.23,11,-4.090180325682565
US:615682,"Most the party, except for the RHINOS, support my view of the USA, the world, and people like myself",0.31,25,-2.814190640236559
US:1199865,i believe in sharing. i am not greedy,0.42,9,-1.8912445958345228
US:144221315,"Because I'm not a fucking idiot. I value human rights, free speech, access to healthcare, education, and basic human dignity.",0.54,27,-1.1588518253760554
US:188649613,Can't recall,0.26,3,-3.451366924159564
US:43911819,Because democrats dont do their jobs,0.22,7,-5.648299828280086
US:15636,They are all corrupt greedy self serving liars who only seek to line their pockets and the pockets of their funders and are all as bad as each other,0.5,31,-1.3546920040492527
US:4258213,no comment,0.22,2,-4.992776093219854
US:2350912,"Agreed with basic party principals in the 1960s. Limited government, less federal spending, less taxation, more accountability, free trade, energy independence, strong military, rule of law, oppose Communism/Socialism, state's rights, economic opportunity...",0.25,53,-3.710838310265355
US:185352507,No party made me feel they where for the people,0.22,10,-4.6420717253272334
US:38069276,Because I believe in supporting the lower and middle classes and government has a role to play in building a better society.,0.42,23,-1.8843974619231
US:2849062,"The policies Democrats have installed are exactly how I feel, with my way of thinking.",0.29,17,-3.0825111550170425
US:40781251,"Stand on moral issues, National defense and economic policy",0.22,10,-5.626141691411355
US:330731,They are for the working people,0.47,6,-1.547445377117896
US:195218269,"The Democratic Party represents the policies and issues that I align with, and it’s a big-tent party which is not monolithic, but more inclusive.",0.44,31,-1.7270934985634405
US:181100699,Neither have the guff to handle the real issues.,0.28,11,-3.1648723507770216
US:187420869,Because even though i used to vote democrat they went too far to the left,0.3,15,-2.970766470467337
US:128743307,They align more with my ideals,0.27,6,-3.320438410455778
US:27523731,My views and beliefs are closer to the republican side of the spectrum,0.52,13,-1.2391175296643264
US:1267464,The democrats not being for the people,0.46,8,-1.6149186391229076
US:4476187,"I don't know, both parties are corrupt most of the time.",0.31,14,-2.816154732116813
US:2558132,Political position and stated goals of the candidates running for office,0.42,11,-1.8837204513936232
US:851587,Values are more similar to mine.,0.23,7,-4.336827202832379
US:37300852,Much better than most Republicans,0.23,5,-5.75030908824091
US:1565345,The values and treatment of people less fortunate than I.,0.34,11,-2.4924239650745506
US:161606763,,,0,
US:142885003,Living in NYC is an echo chamber of Liberalism. Having a say in moderation through vote was my goal.,0.22,22,-4.494169370973959
US:122431887,my parents wee,0.34,3,-7.613303989181476
US:595780,"I believe the Democratic party is closer aligned to my beliefs than the other party. I believe in equality for all men and women, I support strong public schools, I want a definite separation of church and state, I think abortion is a women's choice, equal pay for equal work.",0.42,57,-1.881918773010812
US:28264345,don't get into politics,0.31,5,-2.8684572302768423
US:1065644,I choose to live a more peaceful life,0.6,8,-0.821580791300852
US:129248607,"When I compared how Republicans and Democrats saw and did things, I could in no way ever be a Democrat",0.28,21,-3.194037142668493
US:3752804,He started the Nam war.,0.22,6,-5.670393950728293
US:179486649,"I grew up as an evangelical Christian who listened to Rush Limbaugh and later Fox News. When I came out as a gay man in 2012, I began to experience what it was like to be an “other.” I began to see the world differently from a political perspective. I felt so torn that I didn’t vote for president in 2012. I had always voted Republican. I knew Republicans weren’t my friends anymore but couldn’t vote for a Democrat. I then started seeing Nancy Pelosi very differently. And then Trump happened. I was appalled that people were supporting him, and I turned to the Democrats during the 2016 election. After Jan. 6 and everything that has happened, I don’t see myself ever supporting a Republican again.",0.56,154,-1.0556234905498725
US:2297432,I am in disagreement with liberal thinking,0.3,7,-2.941128900887371
US:28244076,I couldn't be a member of a party who supported Trump,0.4,12,-1.9820789676007031
US:13121,Listening to my parents,0.39,4,-2.1034250692750485
US:41524661,Mr Trump caused me to feel closer to the democrats,0.23,11,-4.349080660878339
US:181563451,Too much extreme conservatism in the Republican Party,0.35,8,-2.4112249445001863
US:3010342,Because Regan started all of this bullsh@t,0.22,11,-5.67877892364856
US:128284009,Because I'm not a racist or self righteous christian,0.23,10,-4.416160008949926
US:45168973,I’m gay,0.39,3,-2.0705364492250684
US:41221206,Democrats care more about the average American citizens.,0.26,9,-3.5883323599056323
US:174812831,The blatant lies and hate in the foundation of the right wing. Also consistent failed policies that betray the people,0.25,21,-3.7628872987605075
US:46372878,Barack Obama,0.6,3,-0.8011919287652978
US:174086369,"It necessarily closer. I think the general mood of the Democratic Party has moved left, while my brliefs have remained steady. This means my once democratic beliefs are now more conservatively.",0.22,38,-4.82747371328121
US:2158923,The implicit and explicit racism of republicans.,0.35,9,-2.411694956281565
US:148010525,Because the writers in Mother Jones made more sense than the writers in Newsweek.,0.28,16,-3.1747404064048177
US:41032392,The way things are done in our country,0.7,8,-0.3146830838827416
US:170269399,/,0.22,1,-4.8027486882354
US:183261681,Because they use to be the adults in the room. Now they are more like scared children fighting off a monster,0.45,22,-1.6797583871323405
US:3811972,I have liberal views and I would hear different things and they happened to be from a Democrat so it just made sense that I was a democrat,0.28,28,-3.2418176591140218
US:38336436,I agree more with Republican beliefs,0.26,6,-3.4452488285956973
US:188276831,I started to see the corruption and insanity happening by the Democrats,0.37,12,-2.2620417664286534
US:1466011,I found myself aligning with the Republican viewpoint in general. I consider myself a right leaning Libertarian.,0.51,20,-1.2965918710590134
US:116795299,I was raised these values by my parents,0.44,8,-1.713071466737712
US:188505737,Don't like either,0.29,4,-3.1076083596145825
US:2356963,Democrats recognize concerns of the working class.,0.29,8,-3.046880183424116
US:966541,Politicians are scum,0.45,5,-1.6864704213744965
US:203956021,They stand for most of the things I believe,0.52,9,-1.259335364044708
US:180709497,more fiscally conservative,0.24,5,-3.981520803503085
US:4524198,Inflation,0.48,2,-1.483808520447446
US:39939032,Watching what Ronald Reagan did to our debt/deficit,0.24,11,-3.960000107202697
US:188404835,Because of their morals that closely align with mine and they tend to oppose abortion,0.22,15,-5.124564575556877
US:150433761,Because I don’t have the desire to educate myself on political issues,0.51,13,-1.299825462379918
US:1186901,When I realized the democrats were changing and no longer focused on the American people.,0.33,17,-2.628758466005596
US:191797701,I am a Republican as I believed in our God given US Constitutional Republic and the rule of law on which it stands. Most Republicans stand for our rule of law; while most democrats are leaning towards anarchy and mob rule.,0.33,46,-2.6044095507367153
US:200528197,Because of its progressive and working class orientation .,0.22,9,-4.682565663561947
US:105619,"I was tired of the liberals policies, especially regarding giving rights to illegal immigrants.",0.33,16,-2.5983478120830314
US:46374498,seems to be close to my ideals,0.41,8,-1.911951206095596
US:24243685,I don't understand this question,0.63,6,-0.6434158991009825
US:1114879,Because the Republicans seem to be totally beholden to Trump and his policies to the detriment of the nation and the world. The Democrats also need to abandon their over the top progressive policies for more reasonable ones. Money doesn’t solve all problems.,0.43,48,-1.7907599571996455
US:1148208,Don't know,0.54,3,-1.129306496459096
US:26528663,My beliefs and principles align with those of the Democratic Party the majority of the time,0.64,16,-0.6174303625445876
US:186611857,Same thing values in both parties and I don't want to be locked into one single one. In fact I think there should be multiple parties because there's even though there's independence and fucking green peas or whatever constitutionalists and whatever there are different parties but we want to boils down to it there's only two Republicans and Democrat and I don't know identify with either then so yeah,0.28,76,-6.914068657469304
US:146690641,Because these parties decided to tell me how to live instead of providing service to the people.,0.23,18,-4.092334692608758
US:3174517,I identify much more with the policies of the Republican Party.,0.47,12,-1.5673443022306808
US:376090,They oppose Trump,0.22,3,-4.895019435179779
US:181153799,economy strength,0.23,3,-4.38478761334675
US:28693750,Democrats have done a horrible job in the White House. I believed and still believe Trump will make America Great Again!! Democrats are liars!!,0.34,28,-2.5583314168076887
US:25051106,I'm middle class and work in social services so my values align more with the democrates.,0.27,19,-3.3660089733077485
US:41298844,Freedom and the DEI need to help others.,0.25,10,-3.7955075278675254
US:1824844,Because I've voted for people in both parties.,0.27,10,-3.362072434367917
US:188872699,i liked what the republicans were saying then .,0.22,10,-4.9020421283449895
US:42943674,They are more about people then themselves,0.28,7,-3.140247090661103
US:128046679,they are much more for the regular people in this country. That should always be the first and most important part of what their job is in DC,0.29,29,-3.0653931136644847
US:495928,to save the republic,0.28,4,-3.1518476859256985
US:191656033,Haven't been taught enough or experienced.,0.23,9,-4.2273606882306884
US:41535622,"More progressive, pro-chouce, more fir unions, average people, more accepting of others such as lgbtq,",0.24,25,-6.251913281260847
US:153608619,Felt Democrats connected more with regular people than Republicans,0.22,10,-4.9855007591689615
